{
  "common_predictor_manifest_file_sha256": "aa922173ce0b610764ba38b4a9e8af5ca2bc24103736ca9509ab2ad4abb99fb2",
  "common_predictor_manifest_sha256": "d7aae430e434c51fb5351938714444c0bcd6069f52443a5cfd13c5ca13c8d1a0",
  "common_predictor_panel_sha256": "a95d905602f7782679fc7e22025bd4aa828224cb84b86048ec8e3a23c0467a31",
  "confirmation_read_count": 0,
  "confirmation_sessions": [
    "2024-10-28",
    "2024-10-29",
    "2024-10-30",
    "2024-10-31",
    "2024-11-01",
    "2024-11-04",
    "2024-11-05",
    "2024-11-06",
    "2024-11-07",
    "2024-11-08",
    "2024-11-11",
    "2024-11-12",
    "2024-11-13",
    "2024-11-14",
    "2024-11-15",
    "2024-11-18",
    "2024-11-19",
    "2024-11-20",
    "2024-11-21",
    "2024-11-22",
    "2024-11-25",
    "2024-11-26",
    "2024-11-27",
    "2024-11-29",
    "2024-12-02",
    "2024-12-03",
    "2024-12-04",
    "2024-12-05",
    "2024-12-06",
    "2024-12-09"
  ],
  "estimands": {
    "delta_b1v3": "QLIKE(B0)-QLIKE(B1v3a)",
    "delta_b2": "QLIKE(B1v3a)-QLIKE(B2)",
    "positive_value_favors": "EXPANDED_INFORMATION_SET"
  },
  "information_sets": {
    "B0": [
      "b0v2_log_spot",
      "b0v2_underlying_return_5m",
      "b0v2_underlying_rv_5m",
      "b0v2_underlying_rv_30m",
      "b0v2_log_dollar_volume_5m",
      "b0v2_spy_return_5m",
      "b0v2_spy_rv_30m",
      "b0v2_qqq_return_5m",
      "b0v2_qqq_rv_30m",
      "b0v2_session_sine",
      "b0v2_session_cosine",
      "b0v2_asset_identity"
    ],
    "B1v3a": [
      "b0v2_log_spot",
      "b0v2_underlying_return_5m",
      "b0v2_underlying_rv_5m",
      "b0v2_underlying_rv_30m",
      "b0v2_log_dollar_volume_5m",
      "b0v2_spy_return_5m",
      "b0v2_spy_rv_30m",
      "b0v2_qqq_return_5m",
      "b0v2_qqq_rv_30m",
      "b0v2_session_sine",
      "b0v2_session_cosine",
      "b0v2_asset_identity",
      "b1v3_log_atm_variance_30d",
      "b1v3_log_atm_variance_change_5m",
      "b1v3_log_atm_variance_change_30m"
    ],
    "B2": [
      "b0v2_log_spot",
      "b0v2_underlying_return_5m",
      "b0v2_underlying_rv_5m",
      "b0v2_underlying_rv_30m",
      "b0v2_log_dollar_volume_5m",
      "b0v2_spy_return_5m",
      "b0v2_spy_rv_30m",
      "b0v2_qqq_return_5m",
      "b0v2_qqq_rv_30m",
      "b0v2_session_sine",
      "b0v2_session_cosine",
      "b0v2_asset_identity",
      "b1v3_log_atm_variance_30d",
      "b1v3_log_atm_variance_change_5m",
      "b1v3_log_atm_variance_change_30m",
      "b2_log_trade_count",
      "b2_unique_contract_share",
      "b2_log_mean_trade_premium",
      "b2_log_max_trade_premium",
      "b2_call_put_premium_imbalance_scaled",
      "b2_execution_side_premium_imbalance",
      "b2_repeated_contract_premium_share",
      "b2_strike_concentration",
      "b2_expiry_concentration"
    ]
  },
  "manifest_sha256": "e538ad0052190fc502b0441fed9d5b17f27b0db40d6061860a57e83e6a55f99d",
  "mde_policy": "TRAINING_ONLY_DAILY_CLUSTERS_BEFORE_CONFIRMATION",
  "method": {
    "confirmatory": {
      "alpha_grid": [
        0.0,
        0.01,
        0.1,
        1.0
      ],
      "link": "log_fixed_by_estimator",
      "max_iter": 2000,
      "name": "GammaRegressor",
      "role": "gamma_glm_confirmatory",
      "tolerance": 1e-08
    },
    "embargo_minutes": 30,
    "feature_or_method_selection_from_confirmation": "PROHIBITED",
    "inference": {
      "bootstrap_repetitions": 10000,
      "bootstrap_unit": "XNYS_SESSION_DATE_WITH_ALL_ASSETS",
      "confirmatory_family": [
        "delta_b1v3",
        "delta_b2"
      ],
      "multiplicity": "Holm",
      "seed": 650
    },
    "metrics": {
      "descriptive": [
        "MAE",
        "RMSE"
      ],
      "primary": "QLIKE"
    },
    "purge_minutes": 30,
    "robustness": {
      "grid": {
        "learning_rate": [
          0.03,
          0.05
        ],
        "max_depth": [
          3,
          5
        ],
        "min_child_samples": [
          50
        ],
        "n_estimators": [
          200,
          500
        ],
        "num_leaves": [
          7,
          15
        ],
        "reg_lambda": [
          1.0
        ]
      },
      "name": "LGBMRegressor",
      "objective": "gamma",
      "role": "lightgbm_robustness"
    }
  },
  "one_read_policy": "EXACTLY_ONE_ANALYTICAL_CONFIRMATION_READ",
  "origin_identity_sha256": "7aa1a1927ea3743f46eebfa6e0c1d0aa56f738408f5e9f2c1e1fe54b51670272",
  "outcome_assets": [
    "AAPL",
    "AMZN",
    "META",
    "MSFT",
    "NVDA",
    "TSLA"
  ],
  "outcome_read_count": 0,
  "plan_sha256": "8b68411094d2638b6608e02a4f9dc3205cb834e1a6205d5a0cf0f73a95544b70",
  "retain_all_registered_signs": true,
  "safe_to_evaluate_b1v3": "NO",
  "schema_version": "1.0",
  "source_hashes": {
    "design_sha256": "fdf925175e0f8d22a4323b8110a0816dd3195158b3b875427b745efcff2c4592",
    "evaluation_code_sha256": "eab57f0e67bd99f59325904a2bc4ddfcc3006c6423f3eb185f6367533534ba39",
    "uv_lock_sha256": "f9df1a80f37212c81ef4d9ec466b1e94b764aed5daf84435fae75f345623eaac"
  },
  "stability_dimensions": [
    "asset",
    "session_tercile",
    "training_defined_volatility_regime",
    "provider_timing_assumption"
  ],
  "status": "FROZEN_BEFORE_CONFIRMATION",
  "target_blind": true,
  "timing_sensitivities": {
    "fmp_minutes": [
      1,
      2
    ],
    "massive_cutoff_seconds": [
      0,
      60,
      300
    ],
    "uw_created_at_cutoff_seconds": [
      60,
      120,
      300
    ]
  },
  "training_sessions": [
    "2024-08-02",
    "2024-08-05",
    "2024-08-06",
    "2024-08-07",
    "2024-08-08",
    "2024-08-09",
    "2024-08-12",
    "2024-08-13",
    "2024-08-14",
    "2024-08-15",
    "2024-08-16",
    "2024-08-19",
    "2024-08-20",
    "2024-08-21",
    "2024-08-22",
    "2024-08-23",
    "2024-08-26",
    "2024-08-27",
    "2024-08-28",
    "2024-08-29",
    "2024-08-30",
    "2024-09-03",
    "2024-09-04",
    "2024-09-05",
    "2024-09-06",
    "2024-09-09",
    "2024-09-10",
    "2024-09-11",
    "2024-09-12",
    "2024-09-13",
    "2024-09-16",
    "2024-09-17",
    "2024-09-18",
    "2024-09-19",
    "2024-09-20",
    "2024-09-23",
    "2024-09-24",
    "2024-09-25",
    "2024-09-26",
    "2024-09-27",
    "2024-09-30",
    "2024-10-01",
    "2024-10-02",
    "2024-10-03",
    "2024-10-04",
    "2024-10-07",
    "2024-10-08",
    "2024-10-09",
    "2024-10-10",
    "2024-10-11",
    "2024-10-14",
    "2024-10-15",
    "2024-10-16",
    "2024-10-17",
    "2024-10-18",
    "2024-10-21",
    "2024-10-22",
    "2024-10-23",
    "2024-10-24",
    "2024-10-25"
  ]
}
